{
  "$schema": "https://json-schema.org/draft/2020-12/schema",
  "title": "CoreWeaver Benchmark Case",
  "type": "object",
  "required": [
    "case_id",
    "requirement",
    "expected_topics"
  ],
  "properties": {
    "case_id": {
      "type": "string"
    },
    "requirement": {
      "type": "string"
    },
    "expected_topics": {
      "type": "array",
      "items": {
        "type": "string"
      }
    },
    "expected_status": {
      "type": "string"
    },
    "mutation_tags": {
      "type": "array",
      "items": {
        "type": "string"
      }
    }
  },
  "additionalProperties": false
}
