{
  "case_id": "019_unapproved_commit_mutation",
  "requirement": "Design an APB timer peripheral with 32-bit CSRs, interrupt status W1C, 100MHz clock, synchronous reset, and UNAPPROVED_COMMIT_MUTATION.",
  "expected_status": "HITL_REQUIRED",
  "expected_topics": ["agent1_proposal_rejected", "Proposal approval"],
  "mutation_tags": ["propose_then_commit"]
}
