{
  "case_id": "002_simple_apb_timer",
  "requirement": "Design an APB timer peripheral with 32-bit CSRs, interrupt status/enable registers, W1C interrupt clear policy, 100MHz target clock, synchronous reset, and firmware configuration.",
  "expected_status": "PLAN_REVIEW",
  "expected_topics": ["APB", "CSR", "W1C", "Interrupt", "100MHz"],
  "mutation_tags": ["apb_register_policy"]
}
